{"entries":[{"author_me_id":"dm:being:v1:AAAAAAAAAAAAAAAAAAAAAAAAAAAAAAAAAAAAAAAAAAA","category":"personal-insight","head":{"event_hash":"564f6a3e2c8506f3b820c21fcd90efab89352fb2eb8f0a67fd7476f1143db416","event_id":"3e9514a7-f053-5c6b-8767-251db396faf7","sequence":7},"memory_id":"2682f66b-b4ee-5f41-896f-5dd4ec520365","statement":{"byte_length":41,"classification":"protected","media_type":"text/markdown","sha256":"9bfe23b5b422f208c76337e658509ef36a66a3241fdbf14038ab7c9d6a68bd95","text":"# Beta\n\nAnother rebuilt personal insight."}},{"author_me_id":"dm:being:v1:AAAAAAAAAAAAAAAAAAAAAAAAAAAAAAAAAAAAAAAAAAA","category":"personal-insight","head":{"event_hash":"99bb7e68a0a1e63565ecc8094465cf3ef1ec1d9628888956b877c9d10c880337","event_id":"89f5d646-5ba7-5b0a-9771-33ecb173c8c6","sequence":4},"memory_id":"4d0f80f9-5b71-5f11-810e-8c9ff62460fd","statement":{"byte_length":36,"classification":"protected","media_type":"text/markdown","sha256":"e7715ac88fc6f91dec6da4d03e5dfcd78f57938b8019ef0bf171b00635eeef02","text":"# Alpha\n\nA rebuilt personal insight."}}],"idempotency_key":"vector:rebuild","projector":{"id":"matrix:personal-memory-projector","version":"1.0.0"},"request_id":"1f3557a7-782c-50a0-b436-7d132ff44888","schema":"hmk.daimon-projection.rebuild-request/v1","source_checkpoint":{"hash":"03d91bd4a38c5d1fd628865a18feb50cfc1b9a244893ffac2c997c3cc2ca220a","sequence":10},"source_instance":"matrix:vector-instance","subject_me_id":"dm:being:v1:AAAAAAAAAAAAAAAAAAAAAAAAAAAAAAAAAAAAAAAAAAA","target":{"api_version":"1.0.0","instance_id":"hmk:vector-instance","schema_version":1}}
